<?xml version="1.0" encoding="UTF-8"?>
<xs:schema xmlns:xs="http://www.w3.org/2001/XMLSchema">

	<xs:element name="traits_list">
		<xs:complexType>
			<xs:sequence minOccurs="0" maxOccurs="unbounded">
				<xs:element name="trait" type="xs:token" />
			</xs:sequence>
		</xs:complexType>
		<xs:unique name="uniqueData">
			<xs:selector xpath="trait" />
			<xs:field xpath="." />
		</xs:unique>
	</xs:element>

</xs:schema>