<?xml version="1.0" encoding="UTF-8"?>
<traits_list xmlns:xsi="http://www.w3.org/2001/XMLSchema-instance"
	xsi:noNamespaceSchemaLocation="validation/pendragon-model-trait-list.xsd">
	<trait>energetic</trait>
	<trait>generous</trait>
	<trait>just</trait>
	<trait>merciful</trait>
	<trait>modest</trait>
	<trait>prudent</trait>
	<trait>valorous</trait>
</traits_list>